[{"id":"OR-DUPLICATE01","type":"observation","title":"A","status":"draft","createdAt":"2026-01-01T00:00:00Z","updatedAt":"2026-01-01T00:00:00Z","confidence":"unknown","provenance":"owner-entry"},{"id":"OR-DUPLICATE01","type":"observation","title":"B","status":"draft","createdAt":"2026-01-01T00:00:00Z","updatedAt":"2026-01-01T00:00:00Z","confidence":"unknown","provenance":"owner-entry"}]
