[{"id":"OR-FIXTURE0001","type":"observation","title":"Non-production voltage observation","description":"Fixture only","status":"open","systemId":"electrical","componentIds":["component:calira-evs"],"relatedRecordIds":[],"evidenceRefs":[],"createdAt":"2026-01-01T10:00:00.000Z","updatedAt":"2026-01-01T10:00:00.000Z","occurredAt":"2026-01-01T10:00:00.000Z","confidence":"high","provenance":"owner-observation","measurements":[{"category":"battery-voltage","value":12.7,"unit":"V","measuredAt":"2026-01-01T10:00:00.000Z"}],"history":[{"revisionId":"REV-FIXTURE0001-0001","recordId":"OR-FIXTURE0001","revisionNumber":1,"changedAt":"2026-01-01T10:00:00.000Z","changeType":"created","changedFields":["title"],"previousValues":{},"newValues":{"title":"Non-production voltage observation"},"source":"owner-entry","notes":"Fixture"}]}]
